{
  "$schema": "http://json-schema.org/draft-07/schema#",
  "type": "object",
  "required": ["date", "captured_at", "handoffs", "summary"],
  "properties": {
    "date": { "type": "string" },
    "captured_at": { "type": "string" },
    "handoffs": {
      "type": "array",
      "items": {
        "type": "object",
        "required": ["handoff_id", "producer", "consumer", "artifact", "sent_at"],
        "properties": {
          "handoff_id": { "type": "string" },
          "producer": { "type": "string" },
          "consumer": { "type": "string" },
          "artifact": { "type": "string" },
          "sent_at": { "type": "string" },
          "accepted_at": { "type": "string" },
          "producer_ts": { "type": "string" },
          "consumer_ts": { "type": "string" },
          "sla_status": { "type": "string" },
          "exceptions": { "type": "string" }
        },
        "additionalProperties": true
      }
    },
    "summary": { "type": "object" }
  },
  "additionalProperties": true
}
