{
  "date": "2026-03-12",
  "captured_at": "2026-03-13T01:10:40Z",
  "handoffs": [
    {
      "handoff_id": "h-001",
      "producer": "Executive Office",
      "consumer": "Operations",
      "producer_binding_id": "executive_office:operator",
      "consumer_binding_id": "operations:operator",
      "producer_capability_id": "venture_strategy",
      "consumer_capability_id": "venture_control",
      "artifact": "Daily priorities packet",
      "sent_at": "2026-03-12T14:00:00Z",
      "accepted_at": "2026-03-12T14:06:00Z",
      "producer_ts": "2026-03-12T14:00:00Z",
      "consumer_ts": "2026-03-12T14:06:00Z",
      "sla_target_minutes": 10,
      "latency_minutes": 6,
      "sla_status": "on_time",
      "compliance_status": "on_time",
      "exceptions": ""
    },
    {
      "handoff_id": "h-002",
      "producer": "Operations",
      "consumer": "Data/Analytics",
      "producer_binding_id": "operations:operator",
      "consumer_binding_id": "data_analytics:operator",
      "producer_capability_id": "venture_control",
      "consumer_capability_id": "venture_research",
      "artifact": "Ops sweep incident queue",
      "sent_at": "2026-03-12T14:35:00Z",
      "accepted_at": "2026-03-12T14:42:00Z",
      "producer_ts": "2026-03-12T14:35:00Z",
      "consumer_ts": "2026-03-12T14:42:00Z",
      "sla_target_minutes": 10,
      "latency_minutes": 7,
      "sla_status": "on_time",
      "compliance_status": "on_time",
      "exceptions": ""
    },
    {
      "handoff_id": "h-003",
      "producer": "Data/Analytics",
      "consumer": "Finance",
      "producer_binding_id": "data_analytics:operator",
      "consumer_binding_id": "finance:operator",
      "producer_capability_id": "venture_research",
      "artifact": "KPI baseline refresh + variance dataset",
      "sent_at": "2026-03-12T17:00:00Z",
      "accepted_at": "2026-03-12T20:10:00Z",
      "producer_ts": "2026-03-12T17:00:00Z",
      "consumer_ts": "2026-03-12T20:10:00Z",
      "sla_target_minutes": 60,
      "latency_minutes": 190,
      "sla_status": "late",
      "compliance_status": "late",
      "breach_level": "level_1",
      "breach_owner": "finance:director",
      "breach_action": "Escalate manual reconciliation coverage and republish the variance dataset before closeout.",
      "exceptions": "KPI feed unavailable at standup; manual reconciliation delayed."
    },
    {
      "handoff_id": "h-004",
      "producer": "Finance",
      "consumer": "Executive Office",
      "producer_binding_id": "finance:operator",
      "consumer_binding_id": "executive_office:operator",
      "artifact": "Budget variance closeout note",
      "sent_at": "2026-03-12T22:00:00Z",
      "accepted_at": "2026-03-12T22:05:00Z",
      "producer_ts": "2026-03-12T22:00:00Z",
      "consumer_ts": "2026-03-12T22:05:00Z",
      "sla_target_minutes": 15,
      "latency_minutes": 5,
      "sla_status": "on_time",
      "compliance_status": "on_time",
      "exceptions": ""
    }
  ],
  "summary": {
    "total_handoffs": 4,
    "on_time_handoffs": 3,
    "late_handoffs": 1,
    "exception_handoffs": 0,
    "on_time_rate": 0.75,
    "level_1_breaches": 1,
    "level_2_breaches": 0,
    "level_3_breaches": 0
  }
}
